50,1,12,1,stress,5,,Please rate the amount of stress you experienced in the last 24 hours?,0,None,1,Very Little,2,A Moderate Amount,3,Quite a Bit,4,A Gret Deal,5,NULL,NULL,NULL,NULL,NULL,NULL,NULL,NULL,NULL51,1,12,2,sleep,5,,Please rate the quality of your sleep in the last 24 hours?,0,Excellent,1,Very Good,2,Fair,3,Poor,4,Very Poor,5,NULL,NULL,NULL,NULL,NULL,NULL,NULL,NULL,NULL52,1,12,3,diet,5,,Please rate the quality of your diet in the last 24 hours?,0,Excellent,1,Very Good,2,Fair,3,Poor,4,Very Poor,5,NULL,NULL,NULL,NULL,NULL,NULL,NULL,NULL,NULL53,1,12,4,relation,5,,Please rate the quality of your relationships in the last 24 hours?,0,Excellent,1,Very Good,2,Fair,3,Poor,4,Very Poor,5,NULL,NULL,NULL,NULL,NULL,NULL,NULL,NULL,NULL54,1,12,5,busy,5,,Please rate how busy you were in the last 24 hours?,0,Not at all,1,Slightly Busy,2,Somewhat Busy,3,Moderately Busy,4,Extremely Busy,5,NULL,NULL,NULL,NULL,NULL,NULL,NULL,NULL,NULL55,1,12,6,physical,5,Physical activity is any activity that increases your heart rate and makes you get out of breath for some time.,How many minutes of physical activity did you experience in the last 24 hours?,0,0 mins,1,1-10 mins,2,11-30 mins,3,31-45 mins,4,More Than 45 mins,5,NULL,NULL,NULL,NULL,NULL,NULL,NULL,NULL,NULL